55	Where can I find escorts in Bangalore ?

56	Where do you find female escorts in bangalore ?

57	How do I increase my patience level in life ?
58	How do I increase my patience level ?
60274	What can I do to increase my patience level ?
182276	How can I increase my patience level ?

59	What is treatment of blast crisis in cml ?

60	How can I make myself more attractive as a boy ?

61	Which stream is better in an MBA for a mechanical engineer ?
62	Which stream in MBA is best for a mechanical engineer ?
62933	Which MBA stream is better to pursue a mechanical engineer as fresher ?
62934	Which MBA stream is best for a Mechanical Engineer ?

63	Can a dog smell drugs if they were inserted inside of a humans anus ?

64	If you were any illegal drug , which one would you be ?

65	What enlightment ideas were in the declaration of independence ?
66	What are three Enlightenment ideas used in the Declaration of Independence ?
97784	What are Enlightenment ideas used in the Declaration of Independence ?
137495	How did the declaration of independence embody enlightenment ideals ?

67	I would like to start a tamil channel in mumbai , but I need some partnership 09987510597 if anybuddy ?

68	Why is my stomach upset after periods ?

201099	How can I make myself more attractive as a girl ?

364682	How can an average looking guy improve his looks ?

491098	How are enlightenment ideas reflected in the Declaration of Independence ?

