1	What is your review of Hidden Figures -LRB- 2016 movie -RRB- ?
2	What are your impressions of Hidden Figures -LRB- 2017 movie -RRB- ?

3	Currently , all Supreme Court Justices come from very elite law schools , is it similar for the best lawyers in private practice ?

4	What 's your type of jungle -LRB- concrete or nature -RRB- and why ?

5	Why is saltwater taffy candy imported in Austria ?
6	Why is salt water taffy candy unknown in Japan ?
121	Why is Saltwater Taffy candy imported in Hong Kong ?
1709	Why is Saltwater Taffy candy imported in Jamaica ?
1710	Why is Saltwater taffy candy imported in Germany ?
5188	Why is Saltwater taffy candy imported in China ?
5189	Why is Saltwater taffy candy imported in Switzerland ?
5961	Why are saltwater taffy imported in Japan ?
5962	Why is Saltwater taffy candy imported in South Korea ?
6296	Why is Saltwater taffy candy imported in Australia ?
6297	Why is Saltwater taffy candy imported in the Philippines ?
7562	Why is Saltwater taffy candy imported in Japan ?
7563	Why is Saltwater taffy candy imported in Czech Republic ?
11970	Why is Saltwater Taffy candy imported in Poland ?
17274	Why is Saltwater Taffy candy imported in Portugal ?
21708	Why are Saltwater taffy candy imported in the Philippines ?
22239	Why is Saltwater Taffy candy imported in Greece ?
22389	Why are American Saltwater Taffy candies imported in Japan ?
22390	Why is saltwater taffy candy imported in Brazil ?
25401	Why is Saltwater Taffy candy imported in Italy ?
30649	Why is Saltwater taffy candy imported in Mongolia ?
30652	Why is Saltwater taffy candy imported in Laos ?
30710	Why is Saltwater Taffy candy imported in Mexico ?
37367	Why is saltwater Taffy candy imported in Canada ?
52278	Why is Saltwater Taffy candy imported in Spain ?
59982	Why is salt water taffy candy imported in France ?
66089	Why is salt water taffy candy either imported or unknown outside the USA ?
68213	Why is Saltwater taffy candy imported in The Bahamas ?

7	Who has the better stable of characters , DC or Marvel ?

8	Which is better - DC or Marvel ?

9	What is difference between CAT and GMAT in terms of syllabus , admission , difficulty and acceptance ?
10	What is the difference between the CAT and GMAT syllabus ?
16920	What is the difference between the type of questions asked in GMAT and CAT ?
16921	What is the difference between the CAT and the GMAT aspirants ?
88502	What is the difference between the syllabus of CAT and GMAT ?
88503	What is the major difference in the syllabus of CAT and GMAT ?
139769	Which exam is good CAT OR GMAT ?
182274	Are there great differences between preparing for the GMAT and CAT ? If so , what are they ?

11	How can I stop being addicted to love ?

12	How can I stop being so addicted to my phone ?

13	How did we get a picture of the Milky Way Galaxy ?
14	How is the picture of our Milky Way galaxy taken from the outside if we are inside the galaxy ?
123860	How did they take a picture of the Milky Way Galaxy in the Cosmos ' first episode even though we are inside the Milky Way Galaxy ?
193157	How are pictures of our own Galaxy taken from the inside ?
206006	How did we humans take spiral images of the Milky Way from inside of the Milky Way ?
218045	How were we able to take pictures of the Milky Way while we ourselves are in it ?

21086	Marvel Comics : Can Magneto lift or control Mjolnir ?

27819	What would happen if we nuke the Milky Way galaxy ?

36676	If someone takes a cellphone picture of me without my consent , how can I make sure that they 've deleted it ?

56425	How do I stop being addicted to someone ?

110453	CAT or GMAT which one is tougher ?

127367	How do I take pictures of Milky Way ?

150931	DC VS Marvel : which do you like more ?

287950	How do the Marvel and DC Comics villains compare ?

301535	How can I know when a picture was taken ?

303204	What is the most likely death of the Earth ? Is it the Milky Way and Andromeda galaxies colliding , or is it the sun dying and expanding ?

339130	At what speed does our solar system orbit around the center of the Milky Way galaxy ?

